rank,name,Enrollment 9-12,Student-Teacher Ratio,STEM Index,English Proficiency,Graduation Rate,Math Proficiency,College Readiness,long,lat
393,Clark Acad Prep Magnet High School,540,25.0,,5.0,97.9,1.0,6.796,41.872809,-87.752929
395,Urban Prep Chtr Acad Bronzeville High School,365,51.0,,14.0,86.2,4.0,8.988999999999999,41.83092,-87.613434
403,Roosevelt High School,1111,17.0,,9.0,80.5,11.0,19.622,41.965793,-87.714318
415,School of Social Justice High School,305,14.0,,5.0,93.0,5.0,23.592,41.835088,-87.734967
416,Schurz High School,1794,16.0,,9.0,91.2,8.0,15.878,41.9475,-87.735257
422,Uplift Community High School,298,13.0,,11.0,81.4,2.0,9.295,41.966036,-87.652178
425,Julian High School,625,16.0,,5.0,97.4,2.0,7.797000000000001,41.706194,-87.654238
430-647,Ace Technical Charter High School,378,,,5.0,69.3,5.0,7.25,41.769247,-87.690914
430-647,Bogan High School,774,16.0,,4.0,88.9,2.0,12.658,41.749201,-87.721587
430-647,Bowen High School,313,16.0,,0.0,85.7,0.0,14.458,41.734141,-87.557572
430-647,Chicago Excel Academy High School,245,,,0.0,28.8,0.0,0.0,41.692073,-87.653792
430-647,Chicago Virtual Charter School,168,24.0,,28.0,59.4,9.0,0.0,41.880874,-87.65003
430-647,Chicago Vocational Career Acad High School,902,17.0,,4.0,91.1,2.0,5.649,41.738352,-87.572864
430-647,Clemente Community Academy High School,733,17.0,,6.0,91.3,5.0,12.839,41.902659,-87.686415
430-647,Collins Academy High School,289,12.0,,0.0,84.9,0.0,0.0,41.864116,-87.701118
430-647,Corliss High School,369,14.0,,1.0,97.3,2.0,14.607000000000001,41.70669,-87.602746
430-647,Douglass Academy High School,167,13.0,,2.0,86.7,2.0,0.0,41.889978,-87.766666
430-647,Dunbar Vocational Career Acad High School,553,14.0,,1.0,96.1,0.0,3.9389999999999996,41.840497,-87.618181
430-647,Farragut Career Academy High School,810,17.0,,5.0,83.5,4.0,8.658,41.849599,-87.708168
430-647,Fenger Academy High School,226,17.0,,7.0,100.0,7.0,9.434,41.689755,-87.637829
121,Rickover Naval Academy High School,567,21.0,,23.0,97.1,16.0,40.714,41.95745,-87.770434
125,Chicago High School for the Arts,601,60.0,,37.0,94.6,24.0,34.107,41.899482,-87.695008
140,Prosser Career Academy High School,1376,17.0,,14.0,96.5,10.0,42.15,41.919429,-87.761845
143,Taft High School,2996,19.0,,35.0,94.4,28.0,33.49,41.984578,-87.7917
150,Chicago High School for Agricult Sciences,716,18.0,,49.0,93.8,34.0,12.147,41.690265,-87.717625
151,Carver Military Academy High School,500,24.0,,18.0,99.1,16.0,28.211,41.656237,-87.590129
161,Alcott Humanities High School,330,7.0,,24.0,94.9,20.0,26.866,41.935752,-87.68048
164,World Language High School,339,17.0,,13.0,97.3,1.0,57.792,41.835176,-87.735133
168,Mather High School,1471,16.0,,15.0,93.6,20.0,33.754,41.988096,-87.701242
171,Senn High School,1411,16.0,,30.0,89.6,25.0,23.516,41.98904,-87.666754
181,Crane Medical Prep High School,586,19.0,,21.0,98.3,15.0,17.6,41.877007,-87.68323
186,Kennedy High School,1649,16.0,,28.0,87.8,21.0,31.631999999999998,41.79039,-87.780252
191,Hubbard High School,1756,19.0,,17.0,97.4,14.0,33.96,41.780231,-87.718647
192,Disney Ii Magnet High School,487,12.0,,24.0,93.8,14.0,32.366,41.952279,-87.720476
195,South Shore Intl Col Prep High School,591,16.0,,19.0,99.2,8.0,19.259,41.758006,-87.576721
199,Lake View High School,1299,19.0,,20.0,92.0,19.0,26.741999999999997,41.9553,-87.668806
212,Epic Academy High School,499,48.0,,20.0,92.9,16.0,13.415,41.744885,-87.549696
217,Hancock College Preparatory High School,887,18.0,,17.0,93.7,12.0,32.96,41.791996,-87.724931
223,Chicago Academy High School,548,18.0,,24.0,92.8,23.0,15.89,41.943015,-87.776964
224,Curie Metropolitan High School,2937,17.0,,15.0,85.5,17.0,29.956999999999997,41.802267,-87.721659
430-647,Tilden Career Communty Academy High School,273,13.0,,2.0,75.8,2.0,0.0,41.807568,-87.642342
430-647,Urban Prep Chtr Acad West Campus High School,273,27.0,,8.0,96.2,2.0,5.903,41.862652,-87.660073
430-647,Voise Academy High School,300,19.0,,7.0,93.1,3.0,6.959,41.885036,-87.762482
430-647,Wells Community Academy High School,377,15.0,,3.0,96.4,2.0,20.732,41.899153,-87.668292
430-647,Foreman High School,841,15.0,,3.0,88.0,4.0,19.805,41.939701,-87.75305
430-647,Gage Park High School,306,15.0,,1.0,91.8,3.0,14.583,41.791097,-87.68945
430-647,Harlan Community Academy High School,474,17.0,,9.0,95.7,2.0,5.099,41.71836,-87.620875
430-647,Harper High School,165,11.0,,3.0,89.5,3.0,0.0,41.774985,-87.669641
430-647,Hirsch Metropolitan High Schoolool,145,18.0,,0.0,87.9,0.0,0.0,41.754007,-87.601897
430-647,Hope College Prep High School,137,12.0,,0.0,87.5,0.0,0.0,41.79352,-87.641325
430-647,Ijla Charter High School,130,65.0,,13.0,24.4,7.0,0.0,41.845643,-87.684182
430-647,Kelvyn Park High School,383,16.0,,8.0,73.5,5.0,18.694000000000003,41.927759,-87.736214
430-647,Legal Prep Academy Charter Hs,305,,,2.0,91.7,2.0,0.0,41.881831,-87.733774
430-647,Manley Career Academy High School,170,14.0,,3.0,91.8,3.0,17.453,41.870712,-87.6997
430-647,Marshall Metropolitan High School,359,14.0,,4.0,91.6,1.0,7.372000000000001,41.879073,-87.707
430-647,Multicultural Acad of Scholarshp High School,248,13.0,,4.0,85.7,4.0,21.154,41.835473,-87.735642
430-647,Orr Academy High School,383,19.0,,3.0,66.3,3.0,0.0,41.893983,-87.726467
430-647,Raby High School,415,13.0,,1.0,83.6,1.0,4.337,41.885726,-87.715484
430-647,Richards Career Academy High School,250,15.0,,0.0,95.6,0.0,12.234000000000002,41.802802,-87.661983
430-647,Robeson High School,147,13.0,,0.0,85.0,0.0,0.0,41.770296,-87.636872
430-647,Simeon Career Academy High School,1319,20.0,,12.0,98.3,6.0,0.0,41.745602,-87.634833
430-647,Spry Community Links High School,154,17.0,,8.0,72.2,17.0,0.0,41.847709,-87.699807
430-647,Sullivan High School,610,19.0,,4.0,75.0,6.0,8.824,42.002856,-87.668906
430-647,Team Englewood Comm Acad High School,160,13.0,,5.0,76.8,3.0,0.0,41.781981,-87.634412
1,Payton College Preparatory High School,977,18.0,76.6242574202689,98.0,99.1,97.0,93.943,41.901619,-87.634685
2,Northside College Preparatory High School,1069,18.0,77.47497406447741,98.0,98.0,95.0,92.095,41.981346,-87.7079
3,Lane Technical High School,3942,21.0,56.9497516462461,88.0,97.5,88.0,87.359,41.945206,-87.690643
4,Young Magnet High School,1856,20.0,68.8927319910926,93.0,97.2,92.0,81.123,41.878311,-87.663573
5,Jones College Prep High School,1815,20.0,69.03935410580979,89.0,94.6,84.0,78.718,41.872999,-87.627921
8,Brooks College Prep Academy High School,859,22.0,13.0553110328638,78.0,99.0,65.0,67.327,41.694113,-87.615847
9,Phoenix Military Academy High School,540,23.0,4.932321575061531,52.0,99.1,36.0,78.509,41.878717,-87.688269
11,Lindblom Math and Science Academy,1056,18.0,33.2786413356362,75.0,99.5,55.0,62.558,41.782119,-87.672143
17,Lincoln Park High School,2126,19.0,39.1778903328909,61.0,92.8,56.0,67.859,41.918446,-87.645976
28,Westinghouse High School,1151,18.0,33.354092028661,44.0,98.8,39.0,54.876000000000005,41.918438,-87.645986
33,Devry Advantage Academy High School,196,23.0,24.873651500938102,54.0,100.0,45.0,47.75,41.862686,-87.660653
48,King College Prep High School,638,17.0,,49.0,97.7,31.0,37.583,41.813913,-87.60296
57,Von Steuben Metro Science High School,1735,19.0,,41.0,97.4,35.0,44.082,41.972816,-87.712864
63,Solorio Academy High School,1140,18.0,,31.0,97.6,34.0,48.456,41.794972,-87.71147
68,Back Of the Yards Ib High School,1043,17.0,,28.0,98.8,32.0,44.342,41.807944,-87.67799
80,Chicago Math and Sci Elem Charter,345,16.0,,32.0,94.4,46.0,27.717,42.013456,-87.675121
84,Intrinsic Charter High School,649,21.0,,36.0,94.7,19.0,46.26,41.939693,-87.740995
92,Kenwood Academy High School,1510,20.0,,45.0,96.2,38.0,22.656,41.803371,-87.589394
95,Ogden Int High School,391,8.0,,40.0,95.0,31.0,39.891,41.893903,-87.658848
99,Infinity Math Science and Tech High School,409,15.0,,18.0,100.0,25.0,48.733999999999995,41.835461,-87.735642
232,Washington G High School,1402,17.0,,17.0,88.8,7.0,32.685,41.68775,-87.537966
233,Kelly High School,2016,18.0,,13.0,91.9,16.0,30.771,41.818384,-87.694859
238,Ihsca Charter High School,756,76.0,,5.0,94.4,10.0,39.251,41.845741,-87.685844
240,Chicago Military Academy High School,292,17.0,,17.0,100.0,5.0,13.982999999999999,41.83043,-87.619162
244,Morgan Park High School,1298,18.0,,14.0,85.3,10.0,14.140999999999998,41.69225,-87.665317
253,Williams Medical Prep High School,234,13.0,,6.0,100.0,2.0,19.595,41.80462,-87.624751
261,Air Force Acad High School,331,21.0,,17.0,97.7,11.0,10.87,41.827936,-87.632949
263,Amundsen High School,1166,19.0,,16.0,95.7,17.0,11.944,41.975758,-87.680084
274,Young Womens Leadership Chartr High School,249,,,9.0,98.0,7.0,15.565999999999999,41.844485,-87.61838
276,Phillips Academy High School,528,15.0,,9.0,98.9,2.0,14.394,41.824072,-87.619793
286,Marine Leadership Academy - Ames,556,19.0,,13.0,97.4,17.0,10.855,41.916381,-87.722329
290,Steinmetz College Prep High School,1356,17.0,,15.0,91.9,11.0,25.819000000000003,41.935679,-87.784141
319,Catalyst Charter - Maria Es,558,41.0,,6.0,97.6,6.0,14.808,41.770966,-87.692638
324,Juarez Community Academy High School,1590,17.0,,13.0,90.3,8.0,18.125,41.852882,-87.664533
338,Goode Stem Academy High School,861,18.0,,12.0,96.2,9.0,9.707,41.753946,-87.706463
345,North-Grand High School,959,19.0,,10.0,87.9,7.0,22.945,41.912462,-87.73496
351,Urban Prep Chtr Acad Englewood High School,324,46.0,,7.0,89.6,6.0,10.526,41.782087,-87.634203
366,Hyde Park Academy High School,725,16.0,,5.0,94.9,4.0,9.652999999999999,41.782217,-87.587062
383,Bronzeville Scholastic High School,372,14.0,,3.0,96.4,1.0,8.298,41.804549,-87.625166
392,Chicago Technology Academy High School,272,,,9.0,96.1,9.0,5.747000000000001,41.863243,-87.659268
